who;occupation;when;quote;source;link;measurable_prediction;timeframe;range_start;range_mean;range_end;tag
Nancy Mace; US Representative, (R-SC);2025-07-22;"Well, some say, some estimates say singularity is like 1000 days away, some say 2000 days away, but it is rapidly approaching either way";Bipartisan Roundtable: Artificial Intelligence in the Real World;https://www.youtube.com/live/q4iMl7iUD6E?t=1490s;Singularity rapidly approaching in 1000 to 2000 days.;in 1000 to 2000 days;2028-04-17;;2031-01-12;asi
Elon Musk;CEO of xAI;2025-07-22;"The @xAI goal is 50 million in units of H100 equivalent-AI compute (but much better power-efficiency) online within 5 years";Twitter post;https://x.com/elonmusk/status/1947704195844608094;xAI aims to have 50 million units of H100 equivalent-AI compute online within 5 years.;within 5 years;;;2030-07-22;compute
Demis Hassabis;CEO of DeepMind;2025-07-23;"My estimate is sort of 50% chance by in the next 5 years. So you know by 2030 let's say.";Podcast with Lex Fridman;https://www.youtube.com/watch?v=-HzgcbRXUK8&t=3150s;AGI achieved by 2030 with a 50% chance.;by 2030;;2030-12-31;;agi
Eric Schmidt;Former CEO of Google;2025-07-17;"When do you see what you define as digital superintelligence? ... within 10 years";Podcast with  Peter Diamandis;https://www.youtube.com/watch?v=qaPHK1fJL5s;Digital superintelligence achieved within 10 years.;within 10 years;;;2035-07-17;asi
Joshua Achiam;Head of Mission Alignment at OpenAI;2025-08-04;"My current best guess is something like: the 2035-2045 period will be the critical window for the transformation of the global economy to accommodate AI and robotics reaching their full potential.";Twitter post;https://x.com/jachiam0/status/1952159244004020453;AI and robotics reaching their full potential during the 2035-2045 period, transforming the global economy.;during the 2035-2045 period;2035-01-01;;2045-12-31;economy
Amjad Masad;CEO of Replit;2025-05-22;"We’re on month three and haven’t had to hire anyone. We think of Replit as our CTO ... I don’t think we’re there yet, where they can run the entire company without hiring engineers, but that might be a year, 18 months away,";Semafor Tech: San Francisco | Semafor Events;https://www.youtube.com/watch?v=y5v1HK5D-_w&t=6980s;AI capable of running an entire company without hiring engineers within a year to 18 months.;within a year to 18 months;2026-05-22;2027-11-22;;jobs
Sholto Douglas;AI Researcher at Anthropic;2025-05-22;"in one where at the very least, you get drop-in white collar worker at some point in the next five years, I think it is very likely in two, but it seems almost overdetermined in five";Podcast with Dwarkesh Patel;https://www.youtube.com/watch?v=64lXQP6cs5M&t=7042s;Drop-in white-collar worker AI achieved in the next two to five years.;in the next two to five years;;2027-05-22;2030-05-22;jobs
Francois Chollet;AI Researcher at ARC Prize;2025-08-11;"[How many years away is AGI?] ... I couldn't really say how many years away I thought we were, you know, last year, but probably 10 yearsish, and now I think it's probably, you know, five, fiveish";Chat with Dwarkesh Patel;https://www.youtube.com/watch?v=1if6XbzD5Yg&t=201s;AGI achieved in about 5 years.;five, fiveish year;;2030-08-11;;agi